award, time, what, details
Dean's Award, 2022 & 2019, "College of Science, National Taiwan University", The top three of the class graduating for outstanding Master's research at the academic year 2021-2022
Dean's Award, 2022 & 2019, "College of Science, National Taiwan University", The top 10% of the class graduating for outstanding scholastic achievement at the academic year 2018-2019
Professor Fa-Yu Cheng Memorial Scholarship, 2019, "Department of Psychology, National Taiwan University", The top prize of undergraduate psychology students for outstanding academic performance at the academic year 2018-2019
Academic Excellence Award, Spring 2017, "Department of Psychology, National Taiwan University", Awarded to students ranking top 5% in the department in the semester
, Spring 2015, "Department of Forest and Resources Conservation, National Taiwan University", Awarded to students ranking top 5% in the department in the semester
